mysql> show databases;
+--------------------+
| Database           |
+--------------------+
| employee_payroll   |
| information_schema |
| mysql              |
| payroll_service    |
| performance_schema |
| sayalidb1          |
| studentdb          |
| sys                |
+--------------------+
8 rows in set (0.12 sec)

mysql> create database AddressBookSystem;
Query OK, 1 row affected (0.04 sec)

mysql> show databases;
+--------------------+
| Database           |
+--------------------+
| addressbooksystem  |
| employee_payroll   |
| information_schema |
| mysql              |
| payroll_service    |
| performance_schema |
| sayalidb1          |
| studentdb          |
| sys                |
+--------------------+
9 rows in set (0.00 sec)

mysql> select database();
+------------+
| database() |
+------------+
| NULL       |
+------------+
1 row in set (0.00 sec)

mysql> use AddressBookSystem;
Database changed
mysql> select database();
+-------------------+
| database()        |
+-------------------+
| addressbooksystem |
+-------------------+
1 row in set (0.00 sec)

mysql> create table Address_book(id int unsigned NOT NULL AUTO_INCREMENT, first_name varchar(15), last_name varchar(10) , city varchar(50),
    ->  state varchar(50), zip int, phoneNo long, email varchar(100), primary key(id)
    -> );
Query OK, 0 rows affected (0.05 sec)

mysql> desc Address_Book;
+------------+--------------+------+-----+---------+----------------+
| Field      | Type         | Null | Key | Default | Extra          |
+------------+--------------+------+-----+---------+----------------+
| id         | int unsigned | NO   | PRI | NULL    | auto_increment |
| first_name | varchar(15)  | YES  |     | NULL    |                |
| last_name  | varchar(10)  | YES  |     | NULL    |                |
| city       | varchar(50)  | YES  |     | NULL    |                |
| state      | varchar(50)  | YES  |     | NULL    |                |
| zip        | int          | YES  |     | NULL    |                |
| phoneNo    | mediumtext   | YES  |     | NULL    |                |
| email      | varchar(100) | YES  |     | NULL    |                |
+------------+--------------+------+-----+---------+----------------+
8 rows in set (0.02 sec)

mysql> insert into Address_Book(first_name,last_name,city,state,zip,phoneNo,email)
    -> values('Shriya','Thakare','Amravati','Maharashtra',444906,1234345646,'abcd@gmail.com');
Query OK, 1 row affected (0.03 sec)

//Insert

mysql>  insert into Address_Book(first_name,last_name,city,state,zip,phoneNo,email)
    -> values('Devyani','Deshmukh','Nagpur','Maharashtra',444533,4564651323,'pqr@gmail.com');
Query OK, 1 row affected (0.01 sec)

mysql> select * from Address_Book;
+----+------------+-----------+----------+-------------+--------+------------+----------------+
| id | first_name | last_name | city     | state       | zip    | phoneNo    | email          |
+----+------------+-----------+----------+-------------+--------+------------+----------------+
|  1 | Shriya     | Thakare   | Amravati | Maharashtra | 444906 | 1234345646 | abcd@gmail.com |
|  2 | Devyani    | Deshmukh  | Nagpur   | Maharashtra | 444533 | 4564651323 | pqr@gmail.com  |
+----+------------+-----------+----------+-------------+--------+------------+----------------+
2 rows in set (0.00 sec)

//Update

mysql> update Address_Book set city='Pune' where first_name='Devyani';
Query OK, 1 row affected (0.00 sec)
Rows matched: 1  Changed: 1  Warnings: 0

mysql> select * from Address_Book;
+----+------------+-----------+----------+-------------+--------+------------+----------------+
| id | first_name | last_name | city     | state       | zip    | phoneNo    | email          |
+----+------------+-----------+----------+-------------+--------+------------+----------------+
|  1 | Shriya     | Thakare   | Amravati | Maharashtra | 444906 | 1234345646 | abcd@gmail.com |
|  2 | Devyani    | Deshmukh  | Pune     | Maharashtra | 444533 | 4564651323 | pqr@gmail.com  |
+----+------------+-----------+----------+-------------+--------+------------+----------------+
2 rows in set (0.00 sec)


mysql> alter table Address_Book add type varchar(15) after last_name;
Query OK, 0 rows affected (0.03 sec)
Records: 0  Duplicates: 0  Warnings: 0

mysql> select * from Address_Book;
+----+------------+-----------+------+----------+-------------+--------+------------+----------------+
| id | first_name | last_name | type | city     | state       | zip    | phoneNo    | email          |
+----+------------+-----------+------+----------+-------------+--------+------------+----------------+
|  1 | Shriya     | Thakare   | NULL | Amravati | Maharashtra | 444906 | 1234345646 | abcd@gmail.com |
|  2 | Devyani    | Deshmukh  | NULL | Pune     | Maharashtra | 444533 | 4564651323 | pqr@gmail.com  |
+----+------------+-----------+------+----------+-------------+--------+------------+----------------+
2 rows in set (0.00 sec)

mysql> update Address_Book set type='Cousin' where first_name='Shriya';
Query OK, 1 row affected (0.00 sec)
Rows matched: 1  Changed: 1  Warnings: 0

mysql> update Address_Book set type='Friend' where first_name='Devyani';
Query OK, 1 row affected (0.00 sec)
Rows matched: 1  Changed: 1  Warnings: 0

mysql> select * from Address_Book;
+----+------------+-----------+--------+----------+-------------+--------+------------+----------------+
| id | first_name | last_name | type   | city     | state       | zip    | phoneNo    | email          |
+----+------------+-----------+--------+----------+-------------+--------+------------+----------------+
|  1 | Shriya     | Thakare   | Cousin | Amravati | Maharashtra | 444906 | 1234345646 | abcd@gmail.com |
|  2 | Devyani    | Deshmukh  | Friend | Pune     | Maharashtra | 444533 | 4564651323 | pqr@gmail.com  |
+----+------------+-----------+--------+----------+-------------+--------+------------+----------------+
2 rows in set (0.00 sec)

mysql>
mysql>  select count(id) as person from Address_Book;
+--------+
| person |
+--------+
|      2 |
+--------+
1 row in set (0.01 sec)

//delete

mysql> delete from Address_Book where last_name = 'Deshmukh';
Query OK, 1 row affected (0.00 sec)

mysql> select * from Address_Book;
+----+------------+-----------+--------+----------+-------------+--------+------------+----------------+
| id | first_name | last_name | type   | city     | state       | zip    | phoneNo    | email          |
+----+------------+-----------+--------+----------+-------------+--------+------------+----------------+
|  1 | Shriya     | Thakare   | Cousin | Amravati | Maharashtra | 444906 | 1234345646 | abcd@gmail.com |
+----+------------+-----------+--------+----------+-------------+--------+------------+----------------+
1 row in set (0.00 sec)